{
  "schemaVersion": "1.0.0",
  "id": "GE-009",
  "term": "F4",
  "definition": "Inventory substrate: derived inventory of F2 + F3 + contracts. Regenerated by devai inventory regen; never hand-edited.",
  "authority": "architect",
  "category": "technical",
  "status": "active",
  "aliases": ["Substrate F4", "Inventory"],
  "provenance": ["ex-GE-009@devai-original"]
}
