{
  "schemaVersion": "1.0.0",
  "id": "GE-027",
  "term": "inv-override",
  "definition": "An in-source annotation declaring site-specific deviation from a non-constitutional invariant. Form: // inv-override: INV-XX-NNN reason / ticket / expires / approver. Scanned by devai policy check overrides. Phase 10.B.",
  "authority": "architect",
  "category": "technical",
  "status": "active",
  "see_also": ["GE-019", "GE-026"],
  "provenance": ["ex-GE-027@devai-original"]
}
