{
  "schemaVersion": "1.0.0",
  "id": "GE-026",
  "term": "Severity ladder",
  "definition": "The 5-tier classification of invariant violation impact: constitutional, hard-fail, gate, warn, advisory. Constitutional + hard-fail are un-overridable. Phase 10.A absorbs this from the stech-law draft.",
  "authority": "architect",
  "category": "technical",
  "status": "active",
  "see_also": [
    "GE-019",
    "GE-027"
  ],
  "examples": [
    "constitutional",
    "hard-fail",
    "gate",
    "warn",
    "advisory"
  ],
  "provenance": [
    "ex-GE-026@devai-original"
  ]
}