{
  "schemaVersion": "1.0.0",
  "id": "GE-038",
  "term": "work/",
  "definition": "The DEVAI-II process-intent tree. Architect-authored round plans and handoffs live under work/rounds/; Auditor-authored observations live under work/audit/. It does not contain machine-authored proof records.",
  "authority": "joint",
  "category": "operational",
  "status": "active",
  "see_also": ["GE-039", "GE-040", "GE-044"],
  "provenance": [
    "REV-0006 vocabulary rider ratified by Owner 2026-07-23; definition derived from the successor meta-catalog"
  ]
}
