{
  "schemaVersion": "1.0.0",
  "id": "GE-037",
  "term": "Prompt firewall",
  "definition": "The gate that prevents prompt overlays from expanding Constructor authority into RTD/policy write scopes. devai policy check prompt overlays. Phase 12.B / D-42.",
  "authority": "architect",
  "category": "technical",
  "status": "active",
  "provenance": [
    "ex-GE-037@devai-original"
  ]
}