{
  "schemaVersion": "1.0.0",
  "id": "GE-039",
  "term": "record/",
  "definition": "The DEVAI-II machine-record tree. Verbs append durable proof records under record/proofs/ and regenerators write non-authoritative caches under record/derived/; human roles do not author its contents directly.",
  "authority": "joint",
  "category": "operational",
  "status": "draft",
  "see_also": ["GE-038", "GE-040", "GE-041"],
  "provenance": [
    "REV-0006 vocabulary rider ratified by Owner 2026-07-23; definition derived from the successor meta-catalog"
  ]
}
