{
  "schemaVersion": "1.0.0",
  "id": "GE-020",
  "term": "Trace",
  "definition": "The mapping from invariants to docs, tests, and code areas. In an adopter repository it lives at docs/arch/trace.json; DEVAI-II's own canonical trace lives at law/trace.json. Architect authority only; Inspector consumes but cannot edit.",
  "authority": "architect",
  "category": "technical",
  "status": "active",
  "see_also": ["GE-019"],
  "provenance": [
    "ex-GE-020@devai-original",
    "REV-0006 signal: adopter-side path unmarked",
    "adopter-path marking applied per Owner ratification 2026-07-23"
  ]
}
