{
  "schemaVersion": "1.0.0",
  "id": "GE-032",
  "term": "Release gate",
  "definition": "The pre-deploy gate verdict. Aggregates scorecard decision, invariant catalog presence, and sensor-readings freshness into a single verdict (pass/block/review/inconclusive). devai release gate. Phase 11.B.",
  "authority": "architect",
  "category": "technical",
  "status": "active",
  "see_also": [
    "GE-014",
    "GE-033"
  ],
  "provenance": [
    "ex-GE-032@devai-original"
  ]
}