{
  "schemaVersion": "1.0.0",
  "id": "GE-044",
  "term": "Record meta-structure",
  "definition": "The shared identity and lifecycle fragment carried by every governed append-able artifact: id, title, type, status, date, authority, supersedes, superseded_by, and provenance. Per-family schemas extend the fragment while one generic record check validates lifecycle and supersession integrity.",
  "authority": "joint",
  "category": "technical",
  "status": "draft",
  "see_also": ["GE-023", "GE-038", "GE-042", "GE-043"],
  "provenance": [
    "REV-0006 vocabulary rider ratified by Owner 2026-07-23; definition derived from the successor record contract"
  ]
}
