{
  "schemaVersion": "1.0.0",
  "id": "GE-011",
  "term": "Sensor",
  "definition": "An observation channel against the plant. Each devai sense command wraps an external sensor (tsc, ESLint, vitest, migration check, etc.) and emits a SensorReading. Tests, static analysis, runtime probes, coverage are all sensors. Sensors observe; they do not rewrite semantics.",
  "authority": "architect",
  "category": "technical",
  "status": "active",
  "see_also": ["GE-012", "GE-004"],
  "related_invariants": ["INV-DEVAI-002"],
  "examples": ["tsc invocation", "vitest run", "runtime API probe"],
  "provenance": ["ex-GE-011@devai-original"]
}
