{
  "schemaVersion": "1.0.0",
  "id": "GE-001",
  "term": "Owner",
  "definition": "The role with authority over business and behavioral specifications. The Owner authors journeys, user stories, and acceptance criteria under docs/product/; co-owns the glossary with the Architect. The Owner does not write invariants directly (D-7); Owner artifacts compile to Architect-authored invariants via explicit related_invariants references.",
  "authority": "joint",
  "category": "business",
  "status": "active",
  "see_also": ["GE-004", "GE-005", "GE-019"],
  "related_invariants": ["INV-DEVAI-001"],
  "provenance": ["ex-GE-001@devai-original"]
}
