{
  "schemaVersion": "1.0.0",
  "id": "GE-018",
  "term": "RGR",
  "definition": "Reference Gap Report. Upward semantic-escalation artifact emitted when triage classifies a failure as reference-gap (the RTD is silent, contradictory, or underspecified). The Engineer cannot answer the semantic question alone; the Architect or Owner must clarify. Persisted at .devai/state/rgr/RGR-NNNN.json.",
  "authority": "architect",
  "category": "technical",
  "status": "active",
  "aliases": [
    "Reference Gap Report"
  ],
  "see_also": [
    "GE-013",
    "GE-017"
  ],
  "related_invariants": [
    "INV-DEVAI-005"
  ],
  "provenance": [
    "ex-GE-018@devai-original"
  ]
}