{
  "schemaVersion": "1.0.0",
  "id": "GE-003",
  "term": "Engineer",
  "definition": "The role with authority over application code. The Engineer writes code to satisfy Architect-authored invariants; cannot modify specs or tests. When the spec is silent or contradictory, the Engineer emits an RGR rather than guessing semantics.",
  "authority": "architect",
  "category": "technical",
  "status": "active",
  "see_also": [
    "GE-018",
    "GE-019"
  ],
  "provenance": [
    "ex-GE-003@devai-original"
  ]
}