{
  "schemaVersion": "1.0.0",
  "id": "GE-006",
  "term": "F1",
  "definition": "Architecture-spec substrate in an adopter repository: docs/arch/ (invariants, trace, journeys, glossary). Reference signal for the development loop. The path is adopter-side; DEVAI-II's own canonical specification lives under law/ and product/. Architect-authored.",
  "authority": "architect",
  "category": "technical",
  "status": "active",
  "aliases": ["Substrate F1"],
  "see_also": ["GE-019", "GE-020"],
  "provenance": [
    "ex-GE-006@devai-original",
    "REV-0006 signal: adopter-side path unmarked",
    "adopter-path marking applied per Owner ratification 2026-07-23"
  ]
}
